{
  "schema": "steamcloud.command-capability/v1",
  "issuer": "https://auth.autosteamfarm.com",
  "audience": "urn:steamcloud:command",
  "subject": "usr_demo",
  "tenant_id": "ten_demo",
  "account_id": "acct_demo",
  "operation": "steam.profile.public.refresh",
  "arguments_sha256": "aaaaaaaaaaaaaaaaaaaaaaaaaaaaaaaaaaaaaaaaaaaaaaaaaaaaaaaaaaaaaaaa",
  "jti": "cap_demo",
  "issued_at": "2026-08-18T16:00:00Z",
  "expires_at": "2026-08-18T16:01:00Z",
  "policy_revision": "policy-2026-08-18.1"
}
